{
  "apiVersion": "researchos.dev/v0alpha1",
  "kind": "ModelGenerateRequest",
  "projectId": "example-minimal",
  "experimentRevision": 1,
  "source": "researchos://models/mock",
  "subject": "call.tools",
  "streamid": "stream.models",
  "actor": {
    "id": "mock.deterministic",
    "kind": "ai",
    "modelId": "mock.deterministic.v1"
  },
  "callId": "call.tools.1",
  "fixtureId": "generate-json",
  "providerId": "mock.deterministic",
  "requestedCapabilities": ["generate", "tools"],
  "events": {
    "ai.call.started": {
      "id": "evt.call.tools.started.1",
      "time": "2026-09-04T13:00:00Z"
    },
    "ai.call.completed": {
      "id": "evt.call.tools.completed.1",
      "time": "2026-09-04T13:00:01Z"
    }
  },
  "evidenceRefs": []
}
