{
  "apiVersion": "researchos.dev/v0alpha1",
  "kind": "ModelGenerateRequest",
  "projectId": "example-minimal",
  "experimentRevision": 1,
  "source": "researchos://models/mock",
  "subject": "call.m1-checkpoint",
  "streamid": "stream.models",
  "actor": {
    "id": "mock.deterministic",
    "kind": "ai",
    "modelId": "mock.deterministic.v1"
  },
  "callId": "call.m1-checkpoint.1",
  "fixtureId": "m1-checkpoint-proposal",
  "providerId": "mock.deterministic",
  "requestedCapabilities": ["generate", "json-schema", "seed"],
  "events": {
    "ai.call.started": {
      "id": "evt.call.started.1",
      "time": "2026-09-07T12:00:00Z"
    },
    "ai.call.completed": {
      "id": "evt.call.completed.1",
      "time": "2026-09-07T12:00:01Z"
    }
  },
  "evidenceRefs": []
}
